707,FOURTH POSITION PLANNED UNIT DEVELOPMENT (PUD) RIDER INDICATOR,AlphaNumeric,,1,,"Indicates if a Planned Unit Development (PUD) Rider was recorded with the mortgage loan.
0 or null = not applicable, 1= applicable."
708,FOURTH POSITION MULTIFAMILY RIDER INDICATOR,AlphaNumeric,,1,,"Indicates if a Multifamily Rider was recorded with the mortgage loan.
0 or null = not applicable, 1= applicable."
709,FOURTH POSITION CONDOMINIUM RIDER INDICATOR,AlphaNumeric,,1,,"Indicates if a Condominium Rider was recorded with the mortgage loan.
0 or null = not applicable, 1= applicable."
710,FOURTH POSITION SECOND HOME RIDER INDICATOR,AlphaNumeric,,1,,"Indicates if a Second Home Rider was recorded with the mortgage loan.
0 or null = not applicable, 1= applicable."
711,FOURTH POSITION GOVERNMENT SPONSORED ENTERPRISE (GSE) ELIGIBLE MORTGAGE INDICATOR,AlphaNumeric,,1,,"Indicates if a Government Sponsored Enterprise Mortgage Rider was recorded with the mortgage loan. 
0 or null = not applicable, 1= applicable."
712,FOURTH POSITION VARIABLE RIDER INDICATOR,AlphaNumeric,,1,,"CoreLogic standardized value that indicates if the mortgage loan contains an adjustable or variable rate rider.
0 or null = not applicable, 1= applicable."
FOURTH POSITION OPEN LIEN ARM V2,,,,,,
713,FOURTH POSITION MORTGAGE ARM INITIAL RESET DATE,Numeric,,8,,CoreLogic derived interest rate change date for an adjustable mortgage. First interest rate reset date. Format: YYYYMMDD.
714,FOURTH POSITION MORTGAGE ARM NEXT RESET DATE,Numeric,,8,,Next interest rate change date after first change. Format: YYYYMMDD.
715,FOURTH POSITION MORTGAGE ARM CHANGE INTERVAL,Numeric,,3,,Identifies the number of intervals for interest rate changes for an adjustable mortgage. Numeric value in conjunction with MORTGAGE ARM FREQUENCY.
716,FOURTH POSITION MORTGAGE ARM FREQUENCY,AlphaNumeric,,2,,Indicates the measurement of time in relation to the interest rate reset/change of the adjustable mortgage. Values: W = Weekly; M = Monthly; Q = Quarterly; Y = Yearly.
717,FOURTH POSITION MORTGAGE ARM CALCULATION CHANGE,Numeric,,7,4,Percentage points added to the Index rate to calculate the new interest rate. Value added to current index to determine new interest rate. Only for adjustable rate mortgages.
718,FOURTH POSITION MORTGAGE ARM MAXIMUM INTEREST RATE,Numeric,,7,4,Maximum interest rate allowed per the life of the loan. Lifetime interest rate maximum. Only for adjustable rate mortgages.
719,FOURTH POSITION MORTGAGE ARM INDEX TYPE CODE,AlphaNumeric,,3,,Indicates which index is used to determine the adjustable mortgage interest rate. Value Description SOF SOFR LIB LIBOR CMT Constant Maturity Treasury MTA Monthly Treasury Average LAM LAMA PRM Prime DIS 11th District BIL Treasury Bill FNM FNMA (Fannie Mae) OTH Other
720,FOURTH POSITION MORTGAGE ARM CHANGE PERCENT LIMIT,Numeric,,7,4,Maximum amount the interest rate may increase or decrease for any one adjustment period of the adjustable mortgage. Limit on interest rate change for any single adjustment.
721,FOURTH POSITION MORTGAGE ARM INITIAL CHANGE MAX PERCENT,Numeric,,7,4,Maximum interest rate the adjustable mortgage loan rate can increase from the initial interest rate as per the recorded loan documents. Maximum allowable interest rate indicated on initial reset.
722,FOURTH POSITION MORTGAGE ARM LOOKBACK PERIOD,Numeric,,3,,The number of days back from interest rate change date to acquire index value.
723,FOURTH POSITION MORTGAGE ARM PAYMENT CHANGE DATE,Numeric,,8,,Date of payment change (if different than interest rate change date). Format: YYYYMMDD.
724,FOURTH POSITION MORTGAGE ARM PAY OPTION INDICATOR,Numeric,,1,,"CoreLogic standardized flag that indicates if the mortgage loan has payment options such as interest only, interest and principal or interest and principal with a lump sum. '0 or null = Not Applicable, 1 = Applicable'."
725,FOURTH POSITION MORTGAGE ARM INTEREST ONLY INDICATOR,Numeric,,1,,"CoreLogic standardized flag that indicates the mortgage loan is an interest only payment loan. '0 or null = Not Applicable, 1 = Applicable'."
726,FOURTH POSITION MORTGAGE ARM NEGATIVE AMORTIZATION INDICATOR,Numeric,,1,,"CoreLogic standardized flag that indicates if the mortgage loan has a negative amortization clause. '0 or null = Not Applicable, 1 = Applicable'."
FOURTH POSITION ORIGINATION LENDER,,,,,,
727,FOURTH POSITION LENDER COMPANY CODE,AlphaNumeric,,10,,"CoreLogic standardized lender code that identifies the mortgage lender (e.g., Bank of America = 000003)."
728,FOURTH POSITION LENDER COMPANY NAME,AlphaNumeric,,60,,CoreLogic proprietary and standardized name of lender from CoreLogic proprietary Lender Code table.
729,FOURTH POSITION LENDER FULL NAME,AlphaNumeric,,60,,Full name of Lender as recorded on the original document when no CoreLogic Lender Company Code exists.
730,FOURTH POSITION LENDER LAST NAME,AlphaNumeric,,32,,Name of Lender's Last Name as recorded on the original document when Lender is a Private Party.
731,FOURTH POSITION LENDER FIRST NAME,AlphaNumeric,,60,,Name of Lender's First Name as recorded on the original document when Lender is a Private Party.
732,FOURTH POSITION LENDER ADDRESS,AlphaNumeric,,60,,Address of the Lender as recorded on the original document.
733,FOURTH POSITION LENDER CITY,AlphaNumeric,,40,,Lender City as recorded on the original document.
734,FOURTH POSITION LENDER STATE,AlphaNumeric,,2,,Lender State as recorded on the original document.
735,FOURTH POSITION LENDER ZIP CODE,AlphaNumeric,,9,,Lender ZIP code as recorded on the original document.
FOURTH POSITION CURRENT OPEN LIEN LENDER,,,,,,
736,FOURTH POSITION CURRENTLY ASSIGNED LENDER COMPANY NAME,AlphaNumeric,,60,,Name of current assigned lender for the open lien.
737,FOURTH POSITION CURRENTLY ASSIGNED LENDER COMPANY CODE,AlphaNumeric,,10,,"CoreLogic standardized lender code of current assigned lender for the open lien (e.g., Bank of America = 000003)."
738,FOURTH POSITION CURRENTLY ASSIGNED LENDER LAST NAME,AlphaNumeric,,32,,Name of Lender's Last Name of current assigned lender for the open lien.
739,FOURTH POSITION CURRENTLY ASSIGNED LENDER FIRST NAME,AlphaNumeric,,60,,Name of Lender's First Name of current assigned lender for the open lien.
740,FOURTH POSITION CURRENTLY ASSIGNED LENDER ADDRESS,AlphaNumeric,,60,,Address of the Lender of current assigned lender for the open lien.
741,FOURTH POSITION CURRENTLY ASSIGNED LENDER CITY,AlphaNumeric,,40,,Lender City of current assigned lender for the open lien.
742,FOURTH POSITION CURRENTLY ASSIGNED LENDER STATE,AlphaNumeric,,2,,Lender State of current assigned lender for the open lien.
743,FOURTH POSITION CURRENTLY ASSIGNED LENDER ZIP CODE,AlphaNumeric,,9,,Lender ZIP code of current assigned lender for the open lien.
RENT AMOUNT MODEL,,,,,,
744,ESTIMATED RENTAL VALUE,Numeric,,10,,Estimated rental value of the property.
745,ESTIMATED RENTAL VALUE HIGH,Numeric,,9,2,Prediction Interval – Upper Limit. Calculation is: Estimated rental value + (Forecast Standard Deviation * Estimated rental value of the property). Example: 2000 + (0.1 * 2000) = 2200
746,ESTIMATED RENTAL VALUE LOW,Numeric,,9,2,Prediction Interval – Lower Limit. Calculation is: Estimated rental value – (Forecast Standard Deviation * Estimated rental value of the property). Example: 2000 - (0.1 * 2000) = 1800
747,ESTIMATED RENTAL FORECAST STANDARD DEVIATION SCORE,Numeric,,22,20,Estimated Rental Forecast Standard Deviation - (Actual Rental value will fall within +/- one FSD of the estimated rental value 68 percent of the time.)
748,ESTIMATED RENT AMOUNT MODEL RUN DATE,Numeric,,8,,Date that the Rent Amount Model was run. This model is run on a periodic cycle. This date does not represent the date of fulfillment. Format: YYYYMMDD
749,CAP RATE,Numeric,,9,4,Capitalization rate is the ratio between the net operating income (NOI) (e.g. expected annual income produced by the property) divided by its capital cost or value (e.g. the original price paid to buy the asset) or alternatively its current market value. Used by investors to estimate the return on an investment.
PROPENSITY SCORE - PURCHASE MORTGAGE MODEL,,,,,,
750,PURCHASE MORTGAGE MODEL PROPENSITY SCORE,Numeric,,3,,CoreLogic Derived Score - Predicts the likelihood of the household applying for a purchase mortgage within the next six months. The higher the number the more likely the prediction will occur.
751,PURCHASE MORTGAGE MODEL PROPENSITY SCORE RUN DATE,Numeric,,8,,Date that the Model was run. This model is run on a periodic cycle. This date does not represent the date of fulfillment. Format: YYYYMMDD
PROPENSITY SCORE - LIST FOR SALE MODEL,,,,,,
752,LIST FOR SALE MODEL PROPENSITY SCORE,Numeric,,3,,CoreLogic Derived Score - Predicts the likelihood of the household listing the property for sale within the next six months. The higher the number the more likely the prediction will occur.
753,LIST FOR SALE MODEL PROPENSITY SCORE RUN DATE,Numeric,,8,,Date that the Model was run. This model is run on a periodic cycle. This date does not represent the date of fulfillment. Format: YYYYMMDD
PROPENSITY SCORE - LIST FOR RENT MODEL,,,,,,
754,LIST TO RENT MODEL PROPENSITY SCORE,Numeric,,3,,CoreLogic Derived Score - Predicts the likelihood of the household listing the property for rent within the next six months. The higher the number the more likely the prediction will occur.
755,LIST TO RENT MODEL PROPENSITY SCORE RUN DATE,Numeric,,8,,Date that the Model was run. This model is run on a periodic cycle. This date does not represent the date of fulfillment. Format: YYYYMMDD
PROPENSITY SCORE - HELOC MODEL,,,,,,
756,HELOC MODEL PROPENSITY SCORE,Numeric,,3,,CoreLogic Derived Score - Predicts the likelihood of all properties obtaining a HELOC (Home Equity Line of Credit) or HELOAN (Home Equity Loan) within the next six months. The higher the number the more likely the prediction will occur.
757,HELOC MODEL PROPENSITY SCORE RUN DATE,Numeric,,8,,Date that the Model was run. This model is run on a periodic cycle. This date does not represent the date of fulfillment. Format: YYYYMMDD
PROPENSITY SCORE - REFINANCE MODEL,,,,,,
758,REFINANCE MODEL PROPENSITY SCORE,Numeric,,3,,CoreLogic Derived Score - Predicts the likelihood of the household obtaining refinance transactions within the next six months. The higher the number the more likely the prediction will occur.
759,REFINANCE MODEL PROPENSITY SCORE RUN DATE,Numeric,,8,,Date that the Model was run. This model is run on a periodic cycle. This date does not represent the date of fulfillment. Format: YYYYMMDD
TAX_V2 - PRIOR01,,,,,,
760,PRIOR01 - TOTAL VALUE CALCULATED,Numeric,,11,,"The ""TOTAL"" (i.e., Land + Improvement) Value closest to current market value used for assessment by county or local taxing authorities."
761,PRIOR01 - LAND VALUE CALCULATED,Numeric,,11,,"The ""LAND"" Value closest to current market value used for assessment by county or local taxing authorities."
762,PRIOR01 - IMPROVEMENT VALUE CALCULATED,Numeric,,11,,"The ""IMPROVEMENT"" Value closest to current market value used for assessment by county or local taxing authorities."
763,PRIOR01 - CALCULATED VALUE SOURCE CODE,AlphaNumeric,,1,,"The code appearing in this indicator field reflects the type of values used to seed the TOTAL VALUE CALCULATED field (i.e., A = Assessed, M = Market, P = Appraised, T = Transitional)."
764,PRIOR01 - ASSESSED TOTAL VALUE,Numeric,,11,,The Total Assessed Value of the Parcel's Land & Improvement values as provided by the county or local taxing/assessment authority.
765,PRIOR01 - ASSESSED LAND VALUE,Numeric,,11,,The Assessed Land Value as provided by the county or local taxing/assessment authority.
766,PRIOR01 - ASSESSED IMPROVEMENT VALUE,Numeric,,11,,The Assessed Improvement Value as provided by the county or local taxing/assessment authority.
767,PRIOR01 - MARKET TOTAL VALUE,Numeric,,11,,The Total Market Value of the Parcel's Land & Improvement values as provided by the county or local taxing/assessment authority.
768,PRIOR01 - MARKET LAND VALUE,Numeric,,11,,The Market Land Value as provided by the county or local taxing/assessment authority.
769,PRIOR01 - MARKET IMPROVEMENT VALUE,Numeric,,11,,The Market Improvement Value as provided by the county or local taxing/assessment authority.
770,PRIOR01 - APPRAISED TOTAL VALUE,Numeric,,11,,The Total Appraised Value of the Parcel's Land & Improvement as provided by the county or local taxing/assessment authority.
771,PRIOR01 - APPRAISED LAND VALUE,Numeric,,11,,The Appraised Land Value as provided by the county or local taxing/assessment authority.
772,PRIOR01 - APPRAISED IMPROVEMENT VALUE,Numeric,,11,,The Appraised Improvement Value as provided by the county or local taxing/assessment authority.
773,PRIOR01 - TAX AMOUNT,Numeric,,14,2,The Total Tax amount provided by the county or local taxing/assessment authority.
774,PRIOR01 - TAX YEAR,Numeric,,4,,The tax year for which the taxes were billed.
775,PRIOR01 - ASSESSED YEAR,Numeric,,4,,The assessment year for which the taxes were billed.
776,PRIOR01 - TAX AREA CODE,AlphaNumeric,,10,,CoreLogic standardized code that identifies the tax area associated with the parcel.
777,PRIOR01 - TAX TOTAL RATE PERCENT,Numeric,,7,3,County provided tax rate for the property based on Property Taxes billed through the county.
778,PRIOR01 - TAXABLE IMPROVEMENT VALUE,Numeric,,9,,County provided value of the improvement applied to the parcel used in the calculation of the tax bill.
779,PRIOR01 - TAXABLE LAND VALUE,Numeric,,9,,County provided land value of a parcel used in the calculation of the tax bill.
780,PRIOR01 - TAXABLE OTHER VALUE,Numeric,,9,,"County provided value of fixture, features or miscellaneous values used in the calculation of the tax bill."
781,PRIOR01 - NET TAXABLE AMOUNT,Numeric,,13,2,"County provided value of the net taxable amount produced on the property. This is more commonly on commercial, agricultural and rental properties."
TAX_V2 - PRIOR02,,,,,,
782,PRIOR02 - TOTAL VALUE CALCULATED,Numeric,,11,,"The ""TOTAL"" (i.e., Land + Improvement) Value closest to current market value used for assessment by county or local taxing authorities."
783,PRIOR02 - LAND VALUE CALCULATED,Numeric,,11,,"The ""LAND"" Value closest to current market value used for assessment by county or local taxing authorities."
784,PRIOR02 - IMPROVEMENT VALUE CALCULATED,Numeric,,11,,"The ""IMPROVEMENT"" Value closest to current market value used for assessment by county or local taxing authorities."
785,PRIOR02 - CALCULATED VALUE SOURCE CODE,AlphaNumeric,,1,,"The code appearing in this indicator field reflects the type of values used to seed the TOTAL VALUE CALCULATED field (i.e., A = Assessed, M = Market, P = Appraised, T = Transitional)."
786,PRIOR02 - ASSESSED TOTAL VALUE,Numeric,,11,,The Total Assessed Value of the Parcel's Land & Improvement values as provided by the county or local taxing/assessment authority.
787,PRIOR02 - ASSESSED LAND VALUE,Numeric,,11,,The Assessed Land Value as provided by the county or local taxing/assessment authority.
788,PRIOR02 - ASSESSED IMPROVEMENT VALUE,Numeric,,11,,The Assessed Improvement Value as provided by the county or local taxing/assessment authority.
789,PRIOR02 - MARKET TOTAL VALUE,Numeric,,11,,The Total Market Value of the Parcel's Land & Improvement values as provided by the county or local taxing/assessment authority.
790,PRIOR02 - MARKET LAND VALUE,Numeric,,11,,The Market Land Value as provided by the county or local taxing/assessment authority.
791,PRIOR02 - MARKET IMPROVEMENT VALUE,Numeric,,11,,The Market Improvement Value as provided by the county or local taxing/assessment authority.
792,PRIOR02 - APPRAISED TOTAL VALUE,Numeric,,11,,The Total Appraised Value of the Parcel's Land & Improvement as provided by the county or local taxing/assessment authority.
793,PRIOR02 - APPRAISED LAND VALUE,Numeric,,11,,The Appraised Land Value as provided by the county or local taxing/assessment authority.
794,PRIOR02 - APPRAISED IMPROVEMENT VALUE,Numeric,,11,,The Appraised Improvement Value as provided by the county or local taxing/assessment authority.
795,PRIOR02 - TAX AMOUNT,Numeric,,14,2,The Total Tax amount provided by the county or local taxing/assessment authority.
796,PRIOR02 - TAX YEAR,Numeric,,4,,The tax year for which the taxes were billed.
797,PRIOR02 - ASSESSED YEAR,Numeric,,4,,The assessment year for which the taxes were billed.
798,PRIOR02 - TAX AREA CODE,AlphaNumeric,,10,,CoreLogic standardized code that identifies the tax area associated with the parcel.
799,PRIOR02 - TAX TOTAL RATE PERCENT,Numeric,,7,3,County provided tax rate for the property based on Property Taxes billed through the county.
800,PRIOR02 - TAXABLE IMPROVEMENT VALUE,Numeric,,9,,County provided value of the improvement applied to the parcel used in the calculation of the tax bill.
801,PRIOR02 - TAXABLE LAND VALUE,Numeric,,9,,County provided land value of a parcel used in the calculation of the tax bill.
802,PRIOR02 - TAXABLE OTHER VALUE,Numeric,,9,,"County provided value of fixture, features or miscellaneous values used in the calculation of the tax bill."
803,PRIOR02 - NET TAXABLE AMOUNT,Numeric,,13,2,"County provided value of the net taxable amount produced on the property. This is more commonly on commercial, agricultural and rental properties."
TAX_V2 - PRIOR03,,,,,,
804,PRIOR03 - TOTAL VALUE CALCULATED,Numeric,,11,,"The ""TOTAL"" (i.e., Land + Improvement) Value closest to current market value used for assessment by county or local taxing authorities."
805,PRIOR03 - LAND VALUE CALCULATED,Numeric,,11,,"The ""LAND"" Value closest to current market value used for assessment by county or local taxing authorities."
806,PRIOR03 - IMPROVEMENT VALUE CALCULATED,Numeric,,11,,"The ""IMPROVEMENT"" Value closest to current market value used for assessment by county or local taxing authorities."
807,PRIOR03 - CALCULATED VALUE SOURCE CODE,AlphaNumeric,,1,,"The code appearing in this indicator field reflects the type of values used to seed the TOTAL VALUE CALCULATED field (i.e., A = Assessed, M = Market, P = Appraised, T = Transitional)."
808,PRIOR03 - ASSESSED TOTAL VALUE,Numeric,,11,,The Total Assessed Value of the Parcel's Land & Improvement values as provided by the county or local taxing/assessment authority.
809,PRIOR03 - ASSESSED LAND VALUE,Numeric,,11,,The Assessed Land Value as provided by the county or local taxing/assessment authority.
810,PRIOR03 - ASSESSED IMPROVEMENT VALUE,Numeric,,11,,The Assessed Improvement Value as provided by the county or local taxing/assessment authority.
811,PRIOR03 - MARKET TOTAL VALUE,Numeric,,11,,The Total Market Value of the Parcel's Land & Improvement values as provided by the county or local taxing/assessment authority.
812,PRIOR03 - MARKET LAND VALUE,Numeric,,11,,The Market Land Value as provided by the county or local taxing/assessment authority.
813,PRIOR03 - MARKET IMPROVEMENT VALUE,Numeric,,11,,The Market Improvement Value as provided by the county or local taxing/assessment authority.
814,PRIOR03 - APPRAISED TOTAL VALUE,Numeric,,11,,The Total Appraised Value of the Parcel's Land & Improvement as provided by the county or local taxing/assessment authority.
815,PRIOR03 - APPRAISED LAND VALUE,Numeric,,11,,The Appraised Land Value as provided by the county or local taxing/assessment authority.
816,PRIOR03 - APPRAISED IMPROVEMENT VALUE,Numeric,,11,,The Appraised Improvement Value as provided by the county or local taxing/assessment authority.
817,PRIOR03 - TAX AMOUNT,Numeric,,14,2,The Total Tax amount provided by the county or local taxing/assessment authority.
818,PRIOR03 - TAX YEAR,Numeric,,4,,The tax year for which the taxes were billed.
819,PRIOR03 - ASSESSED YEAR,Numeric,,4,,The assessment year for which the taxes were billed.
820,PRIOR03 - TAX AREA CODE,AlphaNumeric,,10,,CoreLogic standardized code that identifies the tax area associated with the parcel.
821,PRIOR03 - TAX TOTAL RATE PERCENT,Numeric,,7,3,County provided tax rate for the property based on Property Taxes billed through the county.
822,PRIOR03 - TAXABLE IMPROVEMENT VALUE,Numeric,,9,,County provided value of the improvement applied to the parcel used in the calculation of the tax bill.
823,PRIOR03 - TAXABLE LAND VALUE,Numeric,,9,,County provided land value of a parcel used in the calculation of the tax bill.
824,PRIOR03 - TAXABLE OTHER VALUE,Numeric,,9,,"County provided value of fixture, features or miscellaneous values used in the calculation of the tax bill."
825,PRIOR03 - NET TAXABLE AMOUNT,Numeric,,13,2,"County provided value of the net taxable amount produced on the property. This is more commonly on commercial, agricultural and rental properties."
TAX_V2 - PRIOR04,,,,,,
826,PRIOR04 - TOTAL VALUE CALCULATED,Numeric,,11,,"The ""TOTAL"" (i.e., Land + Improvement) Value closest to current market value used for assessment by county or local taxing authorities."
827,PRIOR04 - LAND VALUE CALCULATED,Numeric,,11,,"The ""LAND"" Value closest to current market value used for assessment by county or local taxing authorities."
828,PRIOR04 - IMPROVEMENT VALUE CALCULATED,Numeric,,11,,"The ""IMPROVEMENT"" Value closest to current market value used for assessment by county or local taxing authorities."
829,PRIOR04 - CALCULATED VALUE SOURCE CODE,AlphaNumeric,,1,,"The code appearing in this indicator field reflects the type of values used to seed the TOTAL VALUE CALCULATED field (i.e., A = Assessed, M = Market, P = Appraised, T = Transitional)."
830,PRIOR04 - ASSESSED TOTAL VALUE,Numeric,,11,,The Total Assessed Value of the Parcel's Land & Improvement values as provided by the county or local taxing/assessment authority.
831,PRIOR04 - ASSESSED LAND VALUE,Numeric,,11,,The Assessed Land Value as provided by the county or local taxing/assessment authority.
832,PRIOR04 - ASSESSED IMPROVEMENT VALUE,Numeric,,11,,The Assessed Improvement Value as provided by the county or local taxing/assessment authority.
833,PRIOR04 - MARKET TOTAL VALUE,Numeric,,11,,The Total Market Value of the Parcel's Land & Improvement values as provided by the county or local taxing/assessment authority.
834,PRIOR04 - MARKET LAND VALUE,Numeric,,11,,The Market Land Value as provided by the county or local taxing/assessment authority.
835,PRIOR04 - MARKET IMPROVEMENT VALUE,Numeric,,11,,The Market Improvement Value as provided by the county or local taxing/assessment authority.
836,PRIOR04 - APPRAISED TOTAL VALUE,Numeric,,11,,The Total Appraised Value of the Parcel's Land & Improvement as provided by the county or local taxing/assessment authority.
837,PRIOR04 - APPRAISED LAND VALUE,Numeric,,11,,The Appraised Land Value as provided by the county or local taxing/assessment authority.
838,PRIOR04 - APPRAISED IMPROVEMENT VALUE,Numeric,,11,,The Appraised Improvement Value as provided by the county or local taxing/assessment authority.
839,PRIOR04 - TAX AMOUNT,Numeric,,14,2,The Total Tax amount provided by the county or local taxing/assessment authority.
840,PRIOR04 - TAX YEAR,Numeric,,4,,The tax year for which the taxes were billed.
841,PRIOR04 - ASSESSED YEAR,Numeric,,4,,The assessment year for which the taxes were billed.
842,PRIOR04 - TAX AREA CODE,AlphaNumeric,,10,,CoreLogic standardized code that identifies the tax area associated with the parcel.
843,PRIOR04 - TAX TOTAL RATE PERCENT,Numeric,,7,3,County provided tax rate for the property based on Property Taxes billed through the county.
844,PRIOR04 - TAXABLE IMPROVEMENT VALUE,Numeric,,9,,County provided value of the improvement applied to the parcel used in the calculation of the tax bill.
845,PRIOR04 - TAXABLE LAND VALUE,Numeric,,9,,County provided land value of a parcel used in the calculation of the tax bill.
846,PRIOR04 - TAXABLE OTHER VALUE,Numeric,,9,,"County provided value of fixture, features or miscellaneous values used in the calculation of the tax bill."
847,PRIOR04 - NET TAXABLE AMOUNT,Numeric,,13,2,"County provided value of the net taxable amount produced on the property. This is more commonly on commercial, agricultural and rental properties."
TAX_V2 - PRIOR05,,,,,,
848,PRIOR05 - TOTAL VALUE CALCULATED,Numeric,,11,,"The ""TOTAL"" (i.e., Land + Improvement) Value closest to current market value used for assessment by county or local taxing authorities."
849,PRIOR05 - LAND VALUE CALCULATED,Numeric,,11,,"The ""LAND"" Value closest to current market value used for assessment by county or local taxing authorities."
850,PRIOR05 - IMPROVEMENT VALUE CALCULATED,Numeric,,11,,"The ""IMPROVEMENT"" Value closest to current market value used for assessment by county or local taxing authorities."
851,PRIOR05 - CALCULATED VALUE SOURCE CODE,AlphaNumeric,,1,,"The code appearing in this indicator field reflects the type of values used to seed the TOTAL VALUE CALCULATED field (i.e., A = Assessed, M = Market, P = Appraised, T = Transitional)."
852,PRIOR05 - ASSESSED TOTAL VALUE,Numeric,,11,,The Total Assessed Value of the Parcel's Land & Improvement values as provided by the county or local taxing/assessment authority.
853,PRIOR05 - ASSESSED LAND VALUE,Numeric,,11,,The Assessed Land Value as provided by the county or local taxing/assessment authority.
854,PRIOR05 - ASSESSED IMPROVEMENT VALUE,Numeric,,11,,The Assessed Improvement Value as provided by the county or local taxing/assessment authority.
855,PRIOR05 - MARKET TOTAL VALUE,Numeric,,11,,The Total Market Value of the Parcel's Land & Improvement values as provided by the county or local taxing/assessment authority.
856,PRIOR05 - MARKET LAND VALUE,Numeric,,11,,The Market Land Value as provided by the county or local taxing/assessment authority.
857,PRIOR05 - MARKET IMPROVEMENT VALUE,Numeric,,11,,The Market Improvement Value as provided by the county or local taxing/assessment authority.
858,PRIOR05 - APPRAISED TOTAL VALUE,Numeric,,11,,The Total Appraised Value of the Parcel's Land & Improvement as provided by the county or local taxing/assessment authority.
